company_name,company_industry,deal_stage,deal_amount,deal_source,history_email,history_chat,history_summary,internal_notes,recc_competitor
SunTech Solutions,IT Services,Decision Made,28000,Organic Search,"<!-- Email, Subject: Follow-up on Monday.com Trial - 2024-05-10 09:45:00 -->

From: Alex Patel
To: Emily Brown

Subject: Follow-up on Monday.com Trial

Hi Emily,

I wanted to follow up on your team's experience with the Monday.com trial over the past few weeks. From our previous discussions, it sounded like you were particularly interested in the platform's automations and integrations with third-party tools.

How have you found the workflow automation capabilities so far? Were you able to set up some sample automations to streamline your project management processes? I'd be happy to provide guidance or best practices if needed.

Regarding integrations, I know you mentioned a need to connect Monday.com with your existing CRM and time tracking tools. Have you had a chance to explore the Apps Marketplace and test out those specific integrations? 

As your trial period comes to a close, I wanted to see if you had any other questions or concerns about the platform. We're committed to ensuring that Monday.com meets your team's needs and helps you work more efficiently.

Please let me know if you'd like to schedule a call to discuss your experience further and explore the next steps. I'm confident that Monday.com can bring significant value to your IT projects and help your team collaborate more effectively.

Looking forward to your thoughts!

Best,
Alex

From: Emily Brown
To: Alex Patel
Subject: Re: Follow-up on Monday.com Trial

Hi Alex,

Thanks for checking in. Our team has been actively testing out Monday.com over the past few weeks, and overall, we're quite impressed with the platform's capabilities.

The workflow automations have been a game-changer for us. We were able to set up automations to handle task assignments, notifications, and status updates, which has already saved us a considerable amount of time and reduced the risk of manual errors. 

We also explored the integrations with our CRM and time tracking tools, and we were pleased to find that the setup process was relatively straightforward. Having all our project data synced across systems has given us a more holistic view of our work and has made reporting much easier.

One area where we did have some questions was around the board permissions and guest access. We often collaborate with external clients and vendors, so we want to ensure that we can maintain control over sensitive information while still fostering seamless communication. Could you provide some more details on how we can set up granular permissions and manage guest access?

Apart from that, I think we have a good understanding of the platform's capabilities and how it can support our IT project management needs. We'd like to move forward with implementing Monday.com for our team.

Could you send over a formal proposal with pricing details and an outline of the onboarding and training process? I'd like to review it with my manager and get the necessary approvals.

Thanks again for your support throughout the trial period. We're excited about the potential impact Monday.com can have on our team's productivity and collaboration.

Best regards,
Emily

From: David Lee
To: Emily Brown
Subject: Re: Follow-up on Monday.com Trial

Hi Emily,

I hope you're doing well. I wanted to follow up on the trial and see how your team is enjoying the platform. Alex mentioned that you had some questions about board permissions and guest access, and I'd be happy to help clarify those for you.

We take security and compliance very seriously at Monday.com, and we've implemented robust measures to ensure that your data is protected. Our platform offers granular permission controls, so you can define exactly who has access to specific boards, items, and information. We also have a guest access feature that allows you to invite external collaborators to specific boards, while controlling their level of access.

Let me know if you'd like to schedule a call to discuss this further, and I'll be happy to walk you through the security features in more detail.

Best regards,
David

From: Emily Brown
To: David Lee
Subject: Re: Follow-up on Monday.com Trial

Hi David,

Thanks for reaching out and offering your expertise. I appreciate the clarification on the security features, and I'd love to schedule a call to discuss this further. Our team is eager to ensure that we're implementing the platform in a way that meets our security and compliance requirements.

I'll send over a meeting invite for this week, and we can discuss the next steps for implementing Monday.com for our team.

Thanks again for your support, and I look forward to speaking with you soon.

Best regards,
Emily","<!-- Alex / Emily 1st Video Meeting Transcript - 2024-04-28 14:00:00 -->
Alex: Hi Emily, thanks for joining the call today! How's your experience been with Monday.com so far?
Emily: Hi Alex! Yeah, we've been playing around with it for a couple of weeks now. I have to say, the automation features have been a game-changer for us.
Alex: That's awesome to hear! Automation can really streamline your workflows. What specific pain points were you trying to address with Monday.com?
Emily: Well, we were using a bunch of different tools and spreadsheets to manage our projects, and it was getting really cumbersome. We needed something that could tie everything together and give us a more holistic view.
Alex: I totally get it. It sounds like you were experiencing some serious tool overload! How do you think Monday.com has helped you tackle that issue?
Emily: Honestly, it's been a huge help. The integrations with our existing tools have been seamless, and the automation features have saved us so much time. We're really excited about the potential impact it can have on our team's productivity.
Alex: That's fantastic to hear! I know you mentioned earlier that you had some questions about security and compliance. Can you tell me more about that?
Emily: Yeah, we work with a lot of sensitive client data, so we need to make sure that we're meeting all the necessary security and compliance requirements. We're looking for more guidance on how to set up the platform to meet those needs.
Alex: Absolutely, I understand. David Lee, our security expert, can help clarify those details for you. I'll make sure to loop him in on our conversation.
<!-- David / Emily 2nd Video Meeting Transcript - 2024-05-03 10:00:00 -->
David: Hi Emily, thanks for joining the call today! I understand you had some questions about security and compliance.
Emily: Hi David, yeah, we're looking for more guidance on how to set up the platform to meet our security and compliance requirements. We work with a lot of sensitive client data, so we need to make sure we're meeting all the necessary standards.
David: Absolutely, I understand. Can you tell me a bit more about your specific requirements? What kind of data are you working with, and what kind of compliance regulations do you need to adhere to?
Emily: Sure. We work with a lot of personal client data, so we need to make sure we're meeting all the necessary GDPR and HIPAA requirements. We're also subject to regular security audits, so we need to make sure we can demonstrate compliance with those standards.
David: Got it. Well, Monday.com takes security and compliance very seriously. We have a robust security framework in place, and we're constantly updating our features to meet the latest compliance requirements. Let me walk you through some of the specific features we have in place to address your needs... (David proceeds to demonstrate the security features)
Emily: That's really helpful, thank you. I feel much more confident now in setting up the platform to meet our security and compliance requirements.
David: You're welcome, Emily. If you have any more questions or need further assistance, please don't hesitate to reach out. We're here to support you throughout the implementation process.","SunTech Solutions has been exploring Monday.com to streamline their IT project management processes. They've been impressed with the automation capabilities and integrations with existing tools. However, they have questions about security and compliance, particularly regarding granular permissions and guest access. They're eager to implement the platform but need guidance on meeting their specific security and compliance requirements.
","* Follow up with Emily Brown to discuss security and compliance requirements in more detail
* Loop in David Lee, security expert, to provide guidance on setting up granular permissions and guest access
* Send over a formal proposal with pricing details and an outline of the onboarding and training process
* Schedule a call to discuss the implementation process and address any further questions or concerns
* Emphasize the importance of security and compliance, and highlight Monday.com's robust security framework and commitment to meeting the latest compliance requirements.",Smartsheets